id,comments_processed
,donating to an e girl is pretty much a downplayed version of flinging money at a strip club. only you dont get a lap dance.
,seems like the girl is asking that dude to a dance or maybe debate based on the sign but he looks like he doesnt want to go with her.
,the girl is super fine enough said! fuck the style of dance! dumb asses!
,my girl is the war dance kind. shes always looking for a fight
,this girl is a tree compared to irelias stylish dance
,we dont hate her. its just that every other girl is superior compared to her. she only became everyones waifu because of that dance
,if your wife is a stripper and doesnt want to give you a lap dance thats weird.
,very good trailer. my wife is a rabid fan of the series. she and i did a happy dance when we listened!!
,my wife is experiencing this right now on her i phone. it looks like just dance hasnt pushed an update to fix this problem yet.
,no joke though. dance central is still way better than  just dance is. my wife is exceptionally bummed the franchise is dead and gone.
,i would like to keep the kinect since my wife is a big fan of just dance!
,watching this while my wife is playing just dance was just hilarious
,kids love when you copy them. my niece is four years old and autistic. she laughs so hard when you copy her dance moves
,so now this girl is just a participation trophy. he asked for a dance so he should have a dance because he asked.
,it sounds like the girl is didnt want to dance the guys didnt want to dance but the adults wanted them to dance. thats ridiculous.
,i think thats adalia rose. and that girl is amazing. look her up on facebook. shes got fashion sense and loves to dance. shes incredible
,hopefully just a dance chaperone. girl is not edumacated enough to teach kids how to finger paint.
,the ok boomer girl isx worse than the pete buttigieg dance
,ive had to do this in dance class but only with a much better foot base! this girl is about to go down.
,i literally sing skimbleshanks weekly and do a little fake tap-dance whenever my wife is feeling down. gets her rolling every time.
,oh shit my wife is at dance class right now. should get home in like an hour. cant wait for that goal
,ive got a buddy whos wife is a cpa. not the dance but im going to look at numbers with her next week to make sure im seeing it all clearly.
,it dances every time the wife is around. i usually end up letting her dance with it until he falls down.
,thats the same dance i do in the bathroom doorway when i need to pee and my wife is sitting on the toilet probably stealing memes on reddit.
,my wife is out at her dance class.
,this girl is a dead ringer for my girl happy dance and all. if i didnt know better id wonder why my phoenix was on reddit in a strange room. haha
,the girl is from darling in the franxx but the dance is from me! me! me! which is an. interesting video on you tube
,that girl is clearly in love and just performing her mating dance!
,wait this girl is dancing? what dance do you call that?
,isnt that the ostrichs mating dance? that poor girl is lucky theres a fence between them.
,the girl is winning the dance off honestly the ostrichs form is garbage
,spider girl is too shy to dance with you. so she sways rhythmically instead lt3
,o girl is tearing up the dance floor! i love her!
,what hurts about this is that i realized the dance this girl is doing is a choreo i learned at a workshop here at my college
,stacy. ok the way she refused to dance with dustin was bitchy. but damn a girl is allowed to say no to a guy if shes not interested.
,and my niece is going to be like a shining diamond when she learns the dance please dont kill me for using the localised name
,playing the witcher while the wife is out grinding her ass on random guys and getting finger blasted on the dance floor
,as a guy its pretty obvious if a girl is giving you a lap dance as a joke or if shes doing it in a sexual way.
,the girl is claire from blade dance and the dude in the bottom pic is some guy from one piece
,poor girl is still grabbing for bits of the bouquet as she lies defeated on the dance floor.
,my girl is colombian. they love to dance. which translates well in the bedroom. they can move their hips very well.
,in my dance class this bitchy girl is constantly yelling and being very obnoxious. she thinks shes special i guess. shes really not.
,i dont believe ballet girl is liz. she would have been too young in to dance in swan lake.
,whats this dance called that girl is doing?? any tutorial for it??
,i usually hate this kinda stuff. but that dude can dance and that girl is oblivious
,the scene when he dance with the ai on the roof. the scene when the billboard hologram girl is closing in on him.
,idk why this girl is here she cant twerk she dont show anything she dont do hot dance she just another ig bored model
,most people on here usually just ignore posts of dance groups but this girl is amazing. she deserves a lot of attention.
,dance for me that girl is amazing
,i love the sassy pose marvel girl is doing in the background! is she doing a dance or attacking magneto?
,sure. dance around the issue and try and mince words on reddit. congratulations. wife is ta. welcome to aita.
,shes just mad a white girl is doing a better dance than her.
,chrissy also knows how to dance. the other girl is just running in place
,he was doing a fortnite dance that girl is doing gods work.
,thisif your girl is a girly girl then you dance and sing with her. if not then play sports with her.
,in the dance network interview alan and hannah said the freestyle is going to be  hannah empowered so im guessing girl is on fire as well!
,they are always so grateful just to be invited to the dance. our girl is happy as long as she is in the same room as any family member.
,or you dance because your wife is fat
,having a house with or more toilets so im not doing the peepee dance while my wife is in there.
,i mean if the wife is dragging up old facebook posts then she initiated it but i will agree that it takes two to tango and op did dance
,they arent. my wife is a health nut. kids are double sport athletes if you count dance as a sport . why do you ask?
,my wife is a uiuc senior and last year made a roombalike robot dance a waltz. what goes on in her mind fascinates me.
,dance like nobodys watching then post it everywhere on the internet. lonely house wife is lonely. this isnt tinder.
,wife is hot  but dude needs to get his dance game on par lol hes standing around like a junior prom haha
,bunny girl is amazing but chika dance template is better.
,totally average girl is forced out of dance dreams and destined for office life instead. wow just call me out like that! lol
,whats the name of the dance move the first girl is doing?
,this girl is so fucking fine.she will have no problem filling her dance card
,that little girl is an excellent dancer! i wished i could dance like that. she reminds me of a cat.
,the only dance appropriate for mr right girl is a middle school style slow dance with enough room left for shower jesus edited to clarify which jesus
,harshita singles dance and pairs skaters!! for real that girl is gold
,the other girl is if aura and catalyst had a fusion dance.
,also the riff from the white stripes  feel in love with a girl is just a sped up version of the one near the end of  mary janes last dance.
,if you make eye contact twice then approach. if youre at the bar getting drinks and a girl is to your side offer a drink or a dance.
,ha..this girl is adorable. her dance is very dorky.but she is s superhit in our state
,honey the neighbors girl is doing the bunny cop dance again outside
,its a little food dance i do them too but usually when my wife is making fresh bread.  also im usually awake
,otherwise its a great game something tells me this is not your first dance with beth and yes gaming with the wife is the 1 best thing about it
,spectacular my wife is watching frasier for the first with me now and moon dance is our next episode! what perfect timing.
,cause hes drunk enough to dance with some super hot chick while his wife is there. and just stair at her ass too.
,my goal to someday slow dance with someone as their wife is hella valid then thank you
,what event where the girl is captured and forced to dance?
,this looks like a middle school dance pose where the guy is tall and lanky and had a growth spurt and the girl is still8 lol
,with exceptions 1. dance floor 2. when the girl is obviously checking you out
,every time we go shopping as a family me and my kid do dance moves in front of the mirrors while my wife is trying on clothes.
,your wife is in labor what do you do? 1. help her 2. dance with the nurses infront of her
,your wife is in labor what do you do? 1. help her 2. dance with the doctors infront of her
,globe  feel like dance wife is from japan. listened to your vocaroo. picked it within seconds.
,curtis turning around to look at the lads while getting a lap dance from a girl is so weird
,your girl is the asshole for doing spilts in a crowded night club. wtf she thinks this is dance dance revolution?
,the contrast of ripped geodude muscle monster doing the most effeminate dance move like a little anime girl is so funny to me lmao
,jeon heejinthis girl is the center visual part of the dance line you can argue shes a main dancer lead vocal and can rap really well
,its sexy if the girl is sexy but the dance. i just dont get it.
,i believe the guards are actually found the hokey pokey and the girl is sad as she doesnt know the dance
,when a girl is spread eagle and giving you a lap dance is different than dancing in the club
,my wife is embarassed by the fact that if mike trout asked me to slow dance. i would probably say yes
,ahaha i am tempted to. the meat grinder would be very nice. the wife is on her first cake. she is doing a little dance during the whole process.
,my wife is dancedrill team. nothing until august. guess every district is different.
,my year old niece is playing dance of the dragons with dany and drogon and the night king and viserion
,this poor girl is going to take a beating. val will be doing her creepycool dance once again.
,the op girl is times better and can actually dance
,that some girl is one of the dance troupe. she also went on to a starring part in frazier.
,oscars wife is like sawyer from  cats dont dance.
,my wife is the exact same way. nearly identical dance moves too!
,are you me? my wife is very frugal so we keep a lot of stuff. i do a victory dance when i get to throw things away.
,my niece is and has a blast with mario party and just dance
,whoever this girl is she cant dance at all. how embarrassing
,really still impressive my lil girl is in dance and i cant ever say shell be able to do that
,if youre not making the same face as this little girl is while youre on the dance floor go sit down.
,think the pec dance girl is sheridan love
,its not trashy this girl is actually a legit pole dance champion the fact that its on a random ass dirty pole outside is whats trashy
,oh ve seen memes about the top hat girl is she the one who does the dance where she waves her hands in the air side to side?
,twerking has to be the least sexy dance in existence the girl is impressive tho
,im surprised china girl is lower than lets dance
,lmao that happens to me every time i dance the scenario emote while theyre doing the yay! like the one a girl is shouting
,that little girl is all of us. wondering  damn those some moves wish i could dance that gracefully
,why would you dance with the giant goblin that wants to squash you when the hot girl is right there beckoning you.
,elevator girl is probably one of their most simple dance routines aha i find them quite easy to pick up but dancing isnt for everyone i guess
,indian girl is an easy first vote. im hoping dance  pt. wins but wouldnt complain if all about you gets it.
,awesome video and friend! every parent needs a friend like this. that baby girl is so entertained and she has smooth dance moves!
,my girl is a booty up sleeper. she wiggles it to put herself to sleep like a little honey bee doing their dance. its the cutest!
,my wife is doing her happy dance chanting . . .  go ala go bama. go ala go bama. go ala go bama  between you and me? the cane makes it a little weird
,my wife is planning on playing dancer. i hope i dont disappoint as a dance partner
,my wife is thai and literally does this exact dance whenever she gets really excited about something.
,i can totally understand this. im3 and my wife is6 but shes the one that takes the lead when we dance and it can be a little awkward sometimes p
,tolo is a school dance where the girls ask the guys. so the girl is the one who made the poster.
,from what ive read before about this video the girl is a dancer for a living and the african kids basically taught her a local dance
,fo schzille de girl is fly! just watch her semi-twerky dance video.
,i dance with two girls that are teachers and one girl is a nurse i say do it.
,looks like his wife is in the middle of doing the ymca dance
,plot twist your wife is banging the dance instructor next door.
,crazy. that thing is just nuts. my wife is doing a happy dance right now since it appears she was right.
,that girl is a horrible fucking dancer. my god. no matter how much i wanted to fuck. id walk away if i saw her dance like that.
,barbie girl is a nice suggestion. or caramell dance
,guy drive drive stop ok? girl  is this the dance of my people
,go dance and interact with the girls there..9 of the time no girl is going to approach you if you just stand awkwardly by the wall
,what a fool i bet no girl is gonna wanna dance with him now.
,its a school dance like prom but less formal. traditionally the girl is the one who asks their partner of choice to attend.
,im hoping my girl is the same. ill be doing a happy dance if all it took was opening a can to get her to eat.
,my wife is a trained dancer and makes fun of my dance moves. so i either avoid it all together. or i embrace my ridiculous moves and go all out.
,the dance comes from the third ending of  kaguyasama love is war and the girl is called chika fujiwara.
,my top girl is looking beautiful in that dress id ask her to dance for sure.  d
,i dont know who this girl is or what movie she was in with super intense dance scenes all i know is she has no ass.
,that girl is having the weirdest dance party ever.
,in wisconsin. engaged.  taxidermy girl is a contender for our first dance at the wedding.
,my wife is atc and most people i tell either think she is the cone guy or in the tower. she didnt spendk in college to dance with the orange cones.
,wife is latina im white. her family cant understand why i dont dance to whatever music they play.dont like the music and cant dance if i did
,what type of dance? my wife is a ballet teacher and knows all the classes ill ask her.
,not mine but my wife is deathly afraid of those chinese dragons people dance around in
,wth.. my wife is close to giving birth and can barely get up from a chair much less dance
,wife is still doing the duty free dance.
,that lil asian girl is who made me want to learn to dance it helps that i live in a very flat very sunny state  you got this bro
,that one girl is so pretty. the one in the yellow green. same girl whos first in the dance cover video with the red bow right?
,not the biggest fan of hannah but this dance girl is so pretty!!
,kissing a girl is pretty easy just go to a club and dance with a drunk girl. getting laid isx harder
,lol that girl is way too excited about the sibling dance  d
,this isnt over reacting to me at least. my wife is a dance teacher and they have strict rules on what they can use and this wouldnt fall under it.
,my wife is a dance teacher and she is pretty graceful. i also suspect she may have been a hired killer after taking her to play paintball once.
,high school dances. these days my wife is embarrassed by how i dance.
,idk if youre aware but your wife is getting fucked on the dance floor.
,maybe hitting the wife is a new dance?
,my niece is that age and loves to dance too. just seeing a kid dancing happily just makes me smile so much.
,jaune screaming hysterically team rwby  some girl is in trouble! also jaune shows up to the dance in the same dress as yang
,it doesnt matter what the guys at the club want it matters if the girl is there to hook up and cheat or just to dance and have fun with her friends
,slav girl is brad and marzia post fusion dance
,i cant tell if the girl is hiding in terror or waiting for her dragon to finish with his water dance so they can go home.
,im sorry your wife is dumb. dance on were thrilled to have you.
,thank you! my wife is from new jersey and thats the one she misses the most. she just did a celebratory dance !
,how? a dude trying to dance with a guys wife is almost certainly gonna lead to a fight when theres also tons of alcohol involved
,were unfamiliar with freyas dance. my wife is partial to the macarena after i come in her but id like her to do the robot.
,how is he an asshat for dancing with someone else? its not even a close intimate dance the wife is the one being an asshat here.
,the green hair girl is struggling to dance and its just soo cute
,the short haired girl is super cute i dont blame the guy for wanting to dance with her! lol
,the kid who did this dance the girl is doing was like and the original video is fucking hilarious. just google orange shirt kid. dude is a legend.
,thank you! i noticed your ready for ballet class pic. my wife is a ballerina and i am a tapper and we both taught each other our kind of dance!
,my wife is from miami. she grew up taking square dance in pe and still wonders why.
,your kids dance or do you? just curious my wife is still dancing at. keeps her in great shape all the best
,i too stan athena. that girl is going to go places even if its not in dance.
,the girl is from fortnite or the dance? amp b
,alright yeah this girl is a total chode. amp b but i couldnt help but laugh at that dumb little dance.
,me too. my girl is like a teenager at a school dance. she stops babbling for a minute with ears up and i know its time to investigate.
,ha my wife is the opposite she loves house music but hates dubstep  bass music because its too slow and she cant dance to it. me i love it all.
,dirty dancing duh my wife is a dance teacher!
,just dance. my wife is weeks pregnant and cant exercise like she likes to so we have been playing just dance as some simple exercise. its just fun
,my wife is a dance teacher and a pre school teacher. can confirm. talks shit about kids all the time. can confirm kids are little assholes.
,makes sense for you. but have you considered those poor pornhub people? fapping to a dance of dressed girl is quite difficult
,this girl is from a dance group. theyre not marketed at kids and they dont make music.
,this girl is so beautiful and she can dance!
,wife is going on a day weekend with the kid starting thursday. youre damn right ill be doing that dance in my underwear right in the living room.
,my wife is still super mega salty about the dance studio! wont show her this one
,months? ive never used it for that i usually dance around in my underwear until my wife is sufficiently aroused.
,i watched her video beating nameless king using the dance pad. that girl is a pretty damn amazing player.
,a girl is always in control. when u dance with someone and she not feeling it.all she has to do is turn around and give u her back.
,yep graham makes me think stealth jeff is true lindsay girl is the queen of the south and will dance with all the globalists at the ball
,bound is a lovely game and not hard. especially if your wife is into dance at all
,my wife is gong to give him tresaderm she has dance me left over from the vet. is it like he a broad spectrum med?
,im7 my wife is0. in our first dance i ended up dancing on my knees because we were both stretching too far.
,this very dance is how i know my wife is in the mood.
,one girl is picked to do everything while the other queens dance in the background?
,dance like no one is watching. that girl is awesome.
,this was quite amusing to watch brilliant dance moves. short haired girl is really attractive too.
,i want more info on the stupid girl. is this that fucking car thing dance? why do we always have to have a thing every summer?
,mirror  girl is showing her hip during dance  views _  latest change safari. x. x fix.
,jane ahin and taeha are my top! jane is top in the group for vocals dance and visual! girl is an all-rounder!
,elevator girl or yava! elevator girl is the first choreography where ive ever had the dance stuck in my head lol
,i live in chicago. go to a russian dance club and meet one. polish ukrainian. my wife is serbian
,even a dude cheating would realize this dumbass game this girl is playing. like ok psycho do your little dance.
,nice dance moves kid and the girl is pretty hot too.
,no moves that the girl is doing are related to that dance lmao
,idk why but whatever dance that girl is doing is oddly hypnotizing.
,the dance in that vine where that girl is dancing to the fire alarm
,i feel like a big girl is never going to win because they cant do the over the top acrobatic dance moves. bummer really.
,hey um mr soon can u um pose naked and uhh dance tos music at my wedding? m-m-my wife is a really big fan of your muscles
,heh my wife is a professional dance choreographer. dance happens everywhere with her.
,my wife is a middle school teacher and she absolutely hates this dance. so naturally i have become pretty good at it.
,my wife is a middle school teacher. she has seen kids do this dance in anger.
,your wife is cute but that dance could not have been less sexy.
,my wife is creole blackish and im a white dude. i was not prepared for family get togethers that included dance offs and free styling.
,i believe my wife is significantly better looking shes a model after all. im tall can play guitar and sing can dance and im emotionally stable.
,my coworker told me his wife is a local dance instructor and he comes to some of the classes in tampa. seems like such a nice dude.
,i know youre joking but its because dance isnt a sport. my wife is a dance teacher dont  me.
,this is girl is from my high school. everyone was super confused at the actual dance. was.uh.quite interesting to see her wheel it around
,the dance battle at the end over a girl is.. surreal and bad but good. dunno what fosse would make of it
,right? it sounds like no ones gone to a dance event before but everyone has a ton of opinions about how a girl is to behave at one
,1. this girl is about sandwiches short of sexy. 2. she didnt dance.
,ur wife is definitely getting her ass groped on the dance floor
,well the owners wife is a belly dancer and they also do belly dance classes. it is pretty hipster.
,reddit? you mean the world is. this girl is famous purely because of her cute dance.
,that girl is me every time i try to dance  i still enjoy it very much
,sex with a shorter girl is a big turn on but dating is different i wouldnt want to slow dance with someone a foot shorter than me
,the frontier ones definitely are the best. the first girl is akari from xros wars. shes wearing a costume for a dance routine.
,if a girl is feeling your approach shes more open to talking andor dancing. youre messing up prior asking her to dance.
,childrens competitive dance teams. my niece is on one and its a total money-suck.
,thats not goofy thats the  im young worth m ive got the body of a god my wife is hot and my grandkids are set for life dance.
,yeah thats not true. reality is much better imo dance off usually until one of them collapsed! source my wife is native american
,this little girl is also being taught how to pole dance
,the girl is from doki doki literature club the dance is from me! me! me!
,im not a huge fan of the ying skindance. poor girl is gonna catch a cold.
,dancing. my wife is under the impression i cant dance at all mostly because i dont like dancing especially in public. but i can most certainly dance.
,my wife is korean. this was our first dance at our wedding.
,im and my wife is this will be myth edc and her very first rave. dance and feel young. its the only way. see you there!
,the fact that my date to the dance is another girl is strange but exciting to me and i cant get it off my mind.
,the girl is just copying all of his different dance moves
,the girl is my dance instructor!
,aww its literally what the girl is saying at the end  it was a dream to dance together with them so my dream has come true.
,its a dance style called merengue. its basically sex while dancing. and that girl is out of control..
,my wife is2 and im6 but we didnt do the first dance custom.
,when your doing a dance for a musical and a girl is supposed to do a lap dance for you. shes feeling that one for sure
,its murder on the dance floor. your wife is short.. and young looking.
,here you can see him dancing the contemporary dance about the loss of his first wife. is. is this a thing?
,poodles are just the sweetest lil pups my girl is too old to dance like this anymore but the two of us are definitely still this ridiculous
,cyberfalls called it  industrial dance specifically and theres a lot more leg action than the girl is doing too.
,that little girl is absolute savage. the fact she just turns to firminho and is like  dance with me. by that wee lassie is going to be a wag  p
,thats the key to making it fun. i go out to drink dance and just generally have a good time. hooking up with a girl is just a bonus
,so if a girl is dancing near me or if she is sitting at a bar. should i just ask would you like to dance with me?
,when a girl is moving to music either killing it on the dance floor or when she doesnt even realize shes doing it. its mesmerizing.
