id,comments_processed
,i think the poetry of joel dying early like his daughter is too good to pass up on even if people see it coming.
,if his daughter is meant to grow up in la among his feminist friends maybe showing her the art of the golf club is a pretty good idea.
,im sorry this is happening for you. at least you know whats happening now. narcissist mothers are quite skilled at the art of the guilt trip.
,his daughter is named after gorbachev and he collects soviet art
,to be fair his daughter is a work of art. i dont understand how he was able to produce such a majestic creature.
,their mothers are in on the joke art project
,meanwhile his daughter is inside the house quietly throwing away the spare change dish she made in art class for him.
,his daughter is already enrolled for art york in unionville hs
,his daughter is my art teacher
,here are some honorable mentions
,sick mothers are the 1 cause of free art commissions!
,kind of a tragic end but a great story. also the art for his daughter is awesome.
,what about all the pictures of him getting a lap dance from his daughter? is that how you hold them?
,his daughter is giving him a lap dance
,the part where dee makes the guy lap dance his daughter is probably the sickest thing any of them do
,i feel like this is some deep artistic dance thats trying to highlight how mothers are the foundation of a family.
,our feelings about our mothers are never simple. of course you miss your mother. im so impressed that you hit that delete button. happy dance!
,is he there with his daughter? is you performing at the dance? is he doing community service work at the school? i have questions.
,or biology. over protective and smothering mothers are common in the oldest literature and stories we have.
,his daughter is nightmare fuel in the light novel.
,the fact that doc rivers has to coach the guy who cheated on his daughter is some bizarre ass story line drama right there
,im seeing some people say the stuff about his daughter is a fake screenshot getting posted around to stir up more drama.
,his daughter is. normally id agree with you but shes a little young to appreciate drama and delayed gratification.
,my expectations for the atfr drama are so high right now that one of theyear olds being his daughter is the only thing that would genuinely shock me.
,or his daughter is a drama queen and is completely lyingexaggerating to get sympathy from strangers. lots of people like that too.
,dont deal with it single mothers are not worth it. to much drama and with an added expense of a child. no thanks.
,i think the president thinks his daughter is a sturdy wooden sculpture of fringe haircut.  wood bang
,and now his daughter is in charge of protecting him. its like a shakespeare play.
,the way biden talks about his wife is ripped right out of the pages of sapphos poetry
,writing poetry to a girl is the fastest way to make her pussy dry up.
,omg! this is like poetry? its like whoa that girl is a dragon yo! this was totally unexpected! girls rule!
,why is this downvoted? dump one in my wife is poetry.
,your wife is pornographic poetry in motion. youre a lucky guy and so is the guy shes riding. id love to be in his place
,your wife is stunning and the way she moves is pornographic poetry in motion
,your wife is stunning and the way she moves is pornographic poetry in motion
,your wife is sexual poetry in motion
,top banana horse girl is like poetry
,my wife is a poet and loves poetry. it is amazing how she can artfully communicate her feelings. its like im reading her heart.
,im not good with emojis but i guess you mean you like shakespeare. it is great to see a beautiful girl is into theater and poetry.
,this girl is a lying ass scammer. dont believe me? . google poetry travis scam
,probably also a work of art poetry in motiona joy foreveronly thing better than long time wife is nothing !!
,this girl is pure poetry.
,my niece is obsessed with this style of poetry and we both think this is among the best weve had the privilege to read. thank you!
,not to be confused with the one where the girl is not shy and talks through poetry.
,udumbledamn thank you for the shirt and super cute limerick! my wife is groaning that my silly poetry and office obsession are both being encouraged!
,playing a guitar for a girl is super cringe might as well just by all black and start reading people bad poetry.
,oasis and poetry are both very good. my sassy girl is a cute rom com if youre into those.
,im guessing the number of times you e recited poetry to a real girl is the same amount of times weve seen shaxxs helmet come off
,roses are red my wife is a widow what did you just say about me you little bitch? beautiful poetry
,well done exmo hallmark writer. i would use this but my wife is not a exmo member and i just dont think she would see the beauty in your poetry.
,the girl is sixteen. how was your poetry at that age?
,the character you think is a girl is busting his nut poetry
,the real answer right here and few people voted for it. my wife is a sign language interpreter and asl poetry is pretty amazing.
,abilities? like this pretty girl is good at the piano and this one writes poetry
,for all you horny toads out there check her tumblr. poor girl is troubled and depressive. her poetry in spanish is harrowing in a way.
,i hope to see your drawings soon my niece is looking for new art for the room polmao
,keep the card card million out of million times. unless your wife is her
,my wife is an art teacherartist. we both love halloween. i sent her a link i know shell love your art too. lt3
,k wife  is art really imitating life.
,picked one of those up at auction last year got a really amazing deal. i have young kids my wife is an art teacher so its her train!
,dot art is super cool my wife is trying this now.
,because hes a religious conservative. people have literally called him homophobic because his wife is an art teacher at a christian school
,shook. paid dollars to frame a  piece of art but the wife is happy so eh.
,my wife is a fellow artist and loves this. she was particularly impressed how you didnt give the art a modern accent. nicely done!
,the girl is asuna from sword art online an the moon is from naruto shippuden.
,this girl is a piece of art
,i really hopeth girl is the cute more chloe from concept art.
,source  the girl is aubrey from nda
,edit it to make it look like a girl is holding the artitll blow up. watch.
,i have one but its different than this one it has game art on the mug and no orange anywhere. my girl is very jealous of it
,its from a gory pixel art gif in which a little girl is flayed by a machine
,art imitates art also that girl is cheeked out her damn mind.
,wow.amazing art! also crossover of the decade? also also teen snoo girl is super cute no hetero
,im usually not a fan of fake boobs but she clearly has one of the most perfect sets ive ever seen. the girl is a work of art.
,the monogatari series has a similar premise but way different execution. if bunny girl is a romcom then monogatari is an art house action comedy
,amazing art but damn i really wanna yeet her off a cliff so badcalling her best girl is very much pushing boundaries-
,this girl is good i bought her art on etsy
,im not really interested in either the art nor the guy. but the girl is stunning
,the girl is usami mizuki from this art club a problem
,that girl is definitely from kuroinu but the art looks like something from thes
,art worthy of best girl is rare but you did it.
,if your on about the video then its sword art online ordinal scale  movie the girl is yuna. sauce  as for the wallpaper sauce
,my wife is a great london based artist she makes original artworks pictures to order and prints. etsy  more on the website
,lol! my wife is an art teacher. . she tells me the same thing in bed sometimes.
,right now my wife is asleep. how about that for reflexive postmodern through the looking glass art meets life cobblers?
,user meilune the creator of hxh is in the hospital and his wife is trying to learn his art style.
,if i remember correctly his wife is trying to imitating his art style to continue the series should anything happen
,thankfully my wife is just as into anime and other collections as i am. her idea for the art on the walls.
,my wife is an artist so have a range of her work mainly in our bedroom. she is also peruvian o we have a selection of peruvian art
,mr. john! your wife is the freakin goat. i love following her art!
,wife is looking good a piece of art.
,art your house is on fire and your wife is home
,togashi is currently in the hospital. his wife is practicing his art style to finish it for him if he doesnt make it.
,i love it.  not a girl is the only acceptable form of  im not like other girls also i love this art style
,lol and they say they dont upvote art because a girl is posing with it but there are multiple posting showing they do
,that cute girl is also doing art uame-kumo
,this art style makes me feel like this girl is gonna challenge me to a game of sealed deck in magic the gathering
,lt3 lt3 lt3 there are no words to describe how awesome your rendition of best girl is! love your art style.
,its official. lattebender girl is my new waifu. we need more art of her
,it kind of is. you can react to anything with it where sentry girl is just stupid art reposted daily
,wait wait hol up hang on a minute. a black art form? this girl is racist as fuck.
,i dont know what the book with the pilot girl is about but it does have some anime fan art when i googled it.
,good art could use more muscle definition on the guy particularly it the stomach. girl is pretty.
,this girl is a fan art and not from an anime am i wrong??
,nice art but everyone knows that the real best girl is beowulf. even though hes not a girl hes so good he steals that title.
,your wife is an amazing artist. i dont even care about the gun i just love that art.
,my wife is an elem art teacher and she will be teaching online just like the other teachers.
,your wife is amazing!! you can look up pixel art too as a little life hack
,the transformed wife is so awful its hard to believe its not satire. anyway cute art op!
,my wife is an artist she goes through the art books. i get collectors editions for games she is into the art style for.
,crap my wife is in high school. that cant be good. great art btw!
,i love the art and dedication. but obsessing over someone elses wife is a bit simplistic.
,absolutely. my wife is an artist. i have to search for her art weekly to make sure its not getting used without her permission.
,i teach art in college and my wife is a middle school teacher.
,shark girl is an underappreciated piece of art
,post it while a girl is holding the art. it will get more upvotes because of simps. anyways good art.
,it looks like a photograph. the girl is so real. great skin colors. the sea is so real. beautiful work of art.
,art of doomer girl is kinda hot doe ngl
,i feel like any art with astolfo as a girl is just automatically cursed regardless of how high quality it is
,i dont know what a white marxist art hoe girl is and im scared to google it.
,a white marxist art hoe girl is all ive ever wanted to be.
,awesome! your wife is super talented. you could sell a lot of video game art.
,your wife is a work of art.
,masha allah thats beautiful! may i ask how you find clientssell your art? my wife is really artistic masha allah but has never sold art.
,wife is art teacher in north philadelphia. i buy art supplies for the kids.
,i like the art but seeing pyro as a lewd anime girl is weird
,sorry! not familiar with rules of sharing art. girl is original background is not
,art is decent though and girl is cute so ill keep reading
,art is decent though and girl is cute so ill keep reading
,the emotion in that girl is overwhelming. what an incredible piece of art. honestly. im enamored and inspired and amazed.
,that one caster girl is also mad they made nsfw art of her.
,oh no the girl is official art from the game! i guess i could just link epic seven on the app store but that seems odd
,the girl is nebula arts oc bidi. you can find their art here  sketch  bidi closeup  full image  full image w cum  imgur album
,the girl is so beautiful and the light from the leaves around her are quite flattering. its a nice and eye-catching piece of art i really like it.
,true art is when the digital painting of a pretty wet-eyed girl is so realistic it could be a photo
,the girl is literally and this art is of her getting married this is whats wrong with the community.
,is it me or are these the same art style of deer as are depicted on the bog body girl? is it possible she came from this time and place?
,there is a genre for art like this. whats it called? where a girl is seen doing raunchy things on a phone while talking to someone.
,used to follow this girl is she still pretending she got famous because of her hard work and art and not because shes a very hot girl in thes?
,my wife is an art teacher in aus she would probably be super keen shes quite introverted though
,one of my favorite quotes is from that movie  art your house is on fire. and your wife is home!  my wife is home?!
,her art kinda gives her a more fitting expression but then again poor girl is so underrated i bet people dont even know what her looks like
,im confused. it looks great but who is the girl? is there any context? is she just existing for the art?
,lately ive been impressed with johannes voss art.  gallia of the endless dance aka whoo girl is something i want a print of.
,1. excuse you my cat girl is beautiful and also i thought she was a kitsune at first lol 2. this is a really beautiful piece of art!
,haha thank you so much! there has been so much amazing art and im loving how much attention our girl is getting right now!
,yes best girl is here thank you very much for real tho ty for doing art in quarantine
,wrong but my favorite part of these posts are the incels that are mad the girl is in the photo. bet you dont bitch when a guy posts next to his art.
,surprised we dont get bots here. posting art of makima or a opm girl is piss-easy karma.
,i have no idea who that girl is  im assuming danganronpa from the art style but this is fucking hilarious.
,is blaze important to the story because i have no idea who this girl isnice art though  d
,nice art buddy but we all know the ultimate vsco girl is sparkpelt
,the girl is from overlord if that helps probably not because you know her name but oh well but i dont know who made this art
,i like how the girl is in a different art-style compared to others in this comic strip.
,art of best girl is meant to be shared
,the real girl is tessa fowler. the art is by kkamja
,. so a tsundere? ngl the art of plantera ive seen as an anime girl is actually pretty cute.
,id totally commission you but a girl is poor rn i wish you the absolute best though im sure your art is amazing!
,anyone who would try to send those tits out of the country is a philistine because that girl is art.
,more wholesome art of best girl is always appreciated and nagisa is pretty awesome too.
,yeah i like it and my non-gamer-wife is willing to play it too. love art atmosphere and how the mechanics model the races uniqueness.
,i recognize that art style and yep her wife is captain you watanabe
,your wife is a cheating turtle with a taste in fine art?
,my wife is a food photographerart director and joked she felt like she was back at work
,my wife is an artist. often i use the quote from the office.  your art is the prettiest art of all the art. but i say it the way roy does lol.
,shit. my wife is an art teacher. thats the first to go.
,no not a furry haha. i know the girl is stylized like most anime characters and the album art is pixel art.
,sauce girl is  revy from black lagoon
,that girl is a real bitch she steals art and doesnt give a shit
,such a perfect art. whoever this pretty girl is. she owes you one.
,this girl is art. i look forward to what she makes of herself. she is astounding!!
,sauce girl is  bowsette
,you can see it on their instagram under a similar name and the bunny girl is a mha character named miruko. their art is incredible
,this girl is the same girl who stole art
,art of best girl is always great especially when its this good! great job on this one!
,so boomer of you fyi crossdressing as a teen girl is an art and were a legion
,at least you remembered to do it! and y is a great pose! i do like that the center girl is different in each art.
,grimm x girl is best kind of rwby art change my mind you cant
,dont wanna ruin your art but isnt it says that zofias girl is years old in game
,beautiful. i wish the picture in my head translated to what my hand draws. my year old niece is far better at art than i.
,my wife is an art teacher and her whole class just made mugs like these in january.
,kate dies toby slips into deep depression kevin and his wife take the kids in the wife is driving jack and hailey from music and art schools.
,my wife is very happy with her new art! thank you!
,so your wife is carrying communism? also the rest of the image is pure art.
,learning blender. wife is doing embroideries and crochettes while rewatching modern family. im playing a few games between makingd art for games.
,wife is flawless. art.
,my wife is the same way. the couch is like a piece of art and shes never happy with it. always complaining about it.
,love this! your girl is very talented. im a big supporter of original art and pick up pieces when i can. looked her up and will follow her work.
,i mean ribbon girl is still on the cover art.
,i really like art like this where a normal girl is pictured or drawn as a yandere. hope we get more of this!
,is it because of saltiness or shitty tumblr art that the popular girl is fatter than her
,what is the name of the anime the girl is in i like the art style
,yeah probably but that girl is a crazy bitch who use the lennon fame and do some distorbing shit and art is not even art is just scream
,yes every art of best girl is very appreciated by me!
,this is blessed more art of best girl is always welcome!!
,girl is sinon from sword art online
,for context ugly girl is supposed to be an artist who wouldnt make free art for our wondrous blue haired girl.
,seriously this girl is hilarious and cute to boot. great design voice of a goddess and yet she has so little art. its an injustice
,i really enjoy this art but. i think its really bad claiming who best girl is because its just gonna get you into a world of trouble on the main sub.
,your art style reminds me of the author of  that girl is not just cute
,its just an art and the girl is from anime black rock shooter
,no that girl is carmilla whereas the girl in the art is from grandblue fantasy.
,the ugly art by machine girl is an even better album
,my wife is cool with playing magic and likes card art but shes not one for building decks. so im the one doing it most of the time.
,thats absolutely fantastic! wish my wife was as supportive. most of the time it seems like my wife is annoyed by my art hobby.
,is that her art? its actually p cool and if my ex-wife is reading this please go away
,i will eventually tue wife is an artist and has to showcase her art to make money. i see nightmare on elm street what else do you have?
,twitter source  da source  of course my irish wife is born on st. patricks day. damn it trigger.
,my wife is one! she creates goth fantasy art and a lot of it has christian themes.
,half of the art of being a trad wife is social distancing great time to start
,my wife is an rn and has been feeling anxious but this really inspired her. please share a printable version! thank you for this great art.
,its not her fault that a bunch of pathetic losers ignore art unless a cute girl is in the picture. shes just playing the game.
,this is a beautiful art piece and the girl is also a nice touch.
,clever girl is the movie quote but i agree this isnt photo realism. still really like the art style though
,how about a slime girl? is that too much?  phylia
,how about a slime girl? is that too much?  phylia
,its t posing. this is a work of art. that girl is gonna be the next bob ross
,i prefer the version where left girl is posing with the art and excitedly saying  look what my girlfriend painted? shes so talented!
,cute art! such a good team too why fight over who the best girl is when you can have both?
,the art is nice. but everyone knows best girl is wiz.
,art of best girl is always welcome here!
,its really refreshing and it fits this movie pretty well since it seems that the girl is going to an art school
,dunno who made the art piece but the modelinspiration for the girl is clearly ilost.unicorn on instagram
,girl is probably as frustrated and annoyed as a kid in art class forced to analyze picasso with no context.
,this girl is so underrated i wish there was more art of her
,this art is amazing! keep it coming. the colonist girl is so cute!! w
,by the way amazing photograph! my wife is a fine art photographer and she would definitely appreciate this.
,my wife is a librarian and part of her job is to arrange and sometimes teach artcraft classes.
,your wife is a goddess! ive yet to actually master the art of round crochet.
,awesome! my wife is a reluctant gamer and art teacher. shouldnt have any trouble getting her to give this a go with me!
,my wife is a painter art not houses.
,its your art my dude stay true to your vision. if your wife is cool with it that sounds like even more of a green light!
,perhaps if ops wife is bored they could look into a part-time job for her and shift the chores a little so she has enough time to practice art?
,thanks for the feedback! my wife is a bird geek so itd definitely be up her alley if only for the theme and beautiful art!
,im glad you said it. but the next time a girl is holding up her art she will still get shit for it.
,i go to art school so every girl is the quiet girl with the dyed hair
,the party girl is here!  d first hand drawn seattle art in the sub.
,dont know if theres a deeper layer but the girl is from the kero kero bonito album art its the singer of the band
,source the other girl is kitashirakawa tomako from  tomako market. her family has a mochi shop.
,you have to admit aside from the hot anime girl is style of art is dope
,cozy lynx girl is top tier. i got her randomly from headhunting and shes been my adjutant since. great fluffy art.
,great gift horsey girl is looking amazing that hair is fabulous. good work on it ve your art is really good.
,a girl is strung up in a machine and a laser cuts her open. its in pixel art style.
,from what i remember of the reference images art style the girl is from an earlys show or movie.
,its not from anything in particular. it just some art someone made. apparently the girl is from idolm i believe her name is shijou takane.
,my wife is an art teacher and a student threatened to kill her and another teacher.
,they most certainly dont. my ex-wife is an art teacher and she didnt even finish a year degree.
,wow she looks great at first i thought it was an official art! your wife is very talented!
,it is so hilarious when people with actualawesome fine art skills do things like this with said skills. omg so funny. your wife is very talented.
,whats wrong with majoring in art with an emphasis in pottery?  the captains wife is doing a great job supporting him.
,thank you so much! my wife is great and she loves how much you all like her art.
,i encase dildoes in epoxy resin to sell them as art and my wife is literally a piece of lint i found in my back pocket. our budget is.2 million.
,rj the wife is too busy with her new tag team wrestling partner jack to care about an art form like videogames.
,the art is gorgeous i bet your wife is soo beautiful too
,this girl is a natural calligrapher. in the era of keyboard and handheld device beautiful even legible handwriting is an almost lost art.
,well damn hopefully your girl is your art museum and not your friend lol
,thinking hes canonically a girl is whack but art of him as a girl is neato
,this girl is on fire.
,im pretty sure this girl is rejected scooby doo concept art.
,dont know. his gf at the time made the art but i dont know if the girl is her
,the girl is definitely from but i think this is fan art or maybe im wrong but i can find that panel. either way though im certain about the girl
,this girl is the nude model for an art class. what the actual fuck?!
,my wife is an artist who post hes stuff for sale online. if you dont constantly update your art people lose interest and dont follow.
,my wife is a fan of closet art. we have some weird ugly paintingspictures hanging in our closets.
,your wife is amazing a true work of art
,wow this art of best girl is amazing
,howcome a lot of art shows care as a black girl? is there anything in petscop that alludes to this?
,fan art of best girl is always welcome. and by that i mean ciel.
,the ear is just too much this girl is truly a piece of art. she seems very calm but who knows lol
,the cat girl is picture from deviant art and bagi is simply a screenshot.
,whilst the art of best girl is fucking brilliant you should really put a spoiler tag on this
,girl is tall. reminds me of that official art for jump mcs where she was  towering over them.
,theres no way this isnt the artists cheating girlfriend and the okra is a substitute for something. this is someth century my girl is a ho slam art.
,so. what is a plumbus for? because. im lost. oh and great art this girl is a keeper. and i hope your butthole is tight
,ng bakarina is killing it! i love it. the art is not as good but its okay. i dont know who that wine splash girl is though.
,araki is making art for the olympics this girl is the torchbearer yo whoever designed this is some mastermind or something
