id,comments_processed
,that could be arranged edit i dont know why i got down voted. my girlfriend is an artist she sells her art.
,judging purely by this your girlfriend is awesome! and makes some sweet art. is she a fan of the show as well or just made this because you were one?
,my girlfriend is going to be an art teacher and loves keith haring. any chance youd sell?
,your girlfriend is very good at art lt3
,this are the best. my girlfriend is just the same. she just looks at my dick like it is a piece of art.
,i have a pop-art neon cat pillow bright orange and a cat etching in the middle my girlfriend is waiting to burn. i love it however.
,my girlfriend is japanese and i actually asked her about this. she said that shes never actually thought about it like that. its just an art style.
,your girlfriend is gold bro nice art style as well
,my girlfriend is art production and she gets this shit all the time. gross.
,my girlfriend is selling her art at this!
,someone actually noticed then.0 hah. my girlfriend is using them for a art project and they just happened to be sitting next to my collection!
,so my girlfriend is an art teacherpainting studio instructor. she just gave me this for my birthday.  she painted it herself.
,girlfriend is on the floor drawing a picture im listening to some old art bell radio its a great night. have a great one as well!
,would be interested in my girlfriend is a geek and sword art online.how much is the shiping for them?
,girlfriend is looking for options as to a career change. shes tired of being an art director at an advertising agency.
,his girlfriend is cute but she tried to shut down preston jacobs for using fan art without attribution
,sorry for those guys but my girlfriend is much finer art.
,xart my girlfriend is back
,what is that suppose to mean? its like when my latina girlfriend is trying to teach me dance salsa and tells me to just feel the music. thanks..
,is it when nicks girlfriend is giving him a lap dance and schmidt pushes her away and shows the girlfriend how to do a lap dance?
,girlfriend is doing a sexy happy dance. o captain my captain
,bad day my girlfriend is sad shell not allowed to dance in graveyards
,imagine living a life where you think dbz is cringe. next youll say doing the fusion dance with your girlfriend is cringe too
,my girlfriend is disabled and wants me to give her a lap dance what difference does that make?
,this is our day we should do whatever we like your girlfriend is right. you wanted to dance so you were doing what you liked. nta
,my girlfriend is shy so it makes sense. they wouldnt even let me buy tickets for us to the school dance.
,my girlfriend is the same way. kid at heart.. except she does her dance when shes eating.
,its a violin version of last dance by big bang. my girlfriend is korean promise im not a koreaboo lmao
,my year old modern dancer college degree in dance girlfriend is the biggest fan of flossing ive ever seen
,girlfriend is better by talking heads always makes me wanna dance. underrated for sure.
,girlfriend is a baller dancer can confirm their feet get super beat up and footankle injuries are very common and can end dance careers pretty early.
,my girlfriend is in dance and they are also required to do a tiktok dance for a grade. i dont know how she feels about it but that must suck
,lol trophy wives are as young as daughters. they would have the same dance moves.
,yta. its just music. i hate those genres too but to spend time your girlfriend is whats important. you dont even have to dance really.
,because my girlfriend is already asleep so i may as well dance my energy away before i do the same
,my girlfriend is embarrassed being in the samevroom as me when i dance
,the school dance in the episode where kevin is cheating with waynes girlfriend is my fav.
,party hard. my girlfriend is so excited that shes doing a funny dance on the floor!
,interrupting your dance makes him an asshole. your girlfriend is oblivious to it which is disrespectful to you. nta super easy case.
,my amazing girlfriend is very supportive and understand. asks me after ever dance kawahi update?
,and just coming as a guest to a school dance seems weird enough but being there to be with and slobber on your underage girlfriend is beyond weird
,my girlfriend is running late. you can just start the dance with just me here
,where do i get hired to dance in walmart while my girlfriend is she provided i assume? shops? sounds like a sweet gig.
,yeah dude your girlfriend is a cunt. its likely she didnt just dance too. please dump her.
,dudes girlfriend is a straight up smoke show. on the warriors dance team.
,my girlfriend is a belly dancer!  .she wont let me watch her dance because its tricky and i spoil her concentration.
,haha my girlfriend is just the same after i made the dance she nearly died cause i looked so dumb
,his girlfriend is probably super jelly of his dance skillz.
,im7. my main partner is0. we dance together just fine! you two will be okay  my girlfriend is9 though and she dances amazing!
,i assumed that if a friends girlfriend is inviting me over to her place alone to give me a lap dance she wants to do more than just dance.
,yall did this same overreaction dance when meteos got traded. the same shit is gonna happen again. altecs girlfriend is not a source.
,thanks for reaching out. i am interested! mind if i ask where you swing dance? my girlfriend is into it and might want to find a place in va for it
,my girlfriend is devastated. she loved the spurs dance team.
,my girlfriend is a sleep talker. one time she sleep talked and we had a conversation about making a dance choreography for her dog.
,id be over the moon. my girlfriend is an all ireland pole dance champion!
,you can check out converge studios. my girlfriend is a dance instructor there xd
,. fairy dance . my girlfriend is trapped by a creep and i have to become a fairy to save her
,i run multiple marathons annually and my girlfriend is a dance instructor. thanks for being an ass though.
,lol my girlfriend is at work so unfortunately its a solo living room dance party for me
,i like to do the airing out my shirt thing that the blonde jock guy does when his girlfriend is doing that crappy talent show dance
,when the dj and the local dance club would play girlfriend is better everyone would stop dance to watch it. also the first dvd i ever bought.
,your girlfriend is ugly as hell said literature teacher.
,aww my girlfriend is the president of the literature club!
,my girlfriend is an md and a neuro scientist. im a literature ph d student working with fiction.
,your girlfriend is what is known in the psychiatric literature as a crazy bitch.
,half girlfriend is not literature maybe. dunno
,top left sakura spirit top right nekopara bottom left my girlfriend is the president bottom right doki doki literature club!
,i love domestic girlfriend is so bad but also really funny and spicy is like a mexican novel but with waifus
,funny thing is half girlfriend is an indian novel
,wo de shouhu nuyou  al  ap  kit  mu  manga  status releasing  genres action adventure ecchi fantasy romance animeampltmangaamp lnamp vnampamp faq
,my girlfriend is using this book called  the day novel that apparently has exercises you do every day and will keep you organized. try it out
,i love the book thief. its a beautiful novel but my girlfriend is bound to cry if we read it. i think we need something a bit happier.
,breaking legacies is a really good one. its a fantasy novel and the main character is a lesbian. her girlfriend is a badass princess
,my girlfriend is a mythical plant? sorry its a fantasy novel from thes.
,his  girlfriend is not entitled to his financials. the best part is that single sentence destroyed the novel you felt you had to write.
,that is a visual novel my girlfriend is a mermaid. only got a digital release in na.
,i appreciate some iranian filmmaking! my girlfriend is persian and introduced me to persepolis. such a compelling movie and graphic novel.
,theres a visual novel called my girlfriend is the president and that is essentially the plot
,oh hey whats happening in index? amp b  coolrd protagonist gets a girlfriend is this even a light novel anymore!? harem amp b oh..
,my girlfriend is a cupcake sounds like a stupid light novel anime title. anyways this is indeed very cute.
,fourth option girlfriend is shopping for pants prints out a novel
,im a pro gamer but my girlfriend is a yandere?!? would make for an excellent light novel really.
,well the main character of my novel is a bi closet monster and her girlfriend is another closet monster so.
,my girlfriend is the one who went and got it got to question her about it. turns out this is what it had to do with
,my girlfriend is faithful virgin bitch light novel titles you never let us down.
,yo lmao im pakistani and my girlfriend is mexican its like a percussion symphony when were together itll be fine
,daughter-wives are always such drama queens.
,yta and your coworkers and their wives are so bored with their lives theyre starting drama for no reason
,when your girlfriend is talking about drama at the workplace
,looking at your post history your girlfriend is shit. just break up with her and end the drama
,my girlfriend is a gumiho is an old drama but i clearly remember that scene.
,gu family book my girlfriend is a gumiho grudge the revolt of gumiho  dark more mature drama the rooftop prince  time traveling
,my girlfriend is a gumiho. it was good drama but now it could be on another level.
,yes! mystic pop-up bar is such a good drama!! your girlfriend is super thoughtful happy birthday!
,youre girlfriend is an entitled spoiled brat mixed with some drama. dump her now.
,rental a girlfriend is a drama but sort of like toradora where it evolves into it.
,yeah our girlfriend is such a drama queen
,i hope you are right. i think that adam being a friend and lydia a possible girlfriend is too much potential drama for a work place.
,its the drama im dying for. sister wives are old news
,my girlfriend is way to invested into you tube drama. she cried over jenna marbles last night for like half an hour.
,my girlfriend is a gumiho its my favorite fantasy drama
,domestic girlfriend is full of drama.
,yes! my girlfriend is a nine tailed fox the soundtrack is so nostalgic really good and old school drama
,my girlfriend is a gumiho princess hours my name is kim sam soon another hyun bin drama hit
,hi my girlfriend is crazy and causing major drama. dont tell me to break up with her. ok so stay with her and stop posting.
,one good thing about not having girlfriend is no drama
,what you just learned is that your girlfriend is selfish and a drama queen. you also learned who she gets it from. i would breakup with her
,his girlfriend is angelika oles. she had a drama yt channel. ellie or whatever her name is tweeted out about it
,my girlfriend is a gumiho is a classic. moorim school is a drama that just shouldnt have ever happened so please save yourself.
,your girlfriend is a drama queen of questionable values. sorry to be cliche but.birds of a feather.
,sounds like a young adult love drama show. lesbian girls girlfriend is pregnant from a guy.
,my girlfriend is an alien. its pretty good definitely better than american drama
,your girlfriend is a drama queen.
,nta your girlfriend is a drama queen
,my girlfriend is a modern drama that seems to fit your criteria. or maybe unexpected? both are pretty lightfluffy.
,nta. youre girlfriend is a drunk idiot and a drama queen
,nta. your girlfriend is a drama queen. was she filming? that shit might just be on social media now for likes and subscribes.
,love is my girlfriend  my girlfriend is your girlfriend such drama
,your girlfriend is another flaky paranoid girl that loves being surrounded by drama get another.
,your girlfriend is a fucked up drama queen.
,you might like the chinese drama my girlfriend is an alien. its weird but she is definitely not afraid of affection.
,nta your girlfriend is damaged no partner is worth that much drama. do yourself a favour and move on.
,nta. youre girlfriend is a hypocrite and you deserve better than someone who apparently gets involved in a lot of drama.
,my girlfriend is a gumiho was my first drama
,not sure the kind of drama youre referring to. my girlfriend is a feminist and i have never had to deal with any kind of drama
,having a girlfriend is not drama.
,premier league on sky club world cup on bbc good job ive got two screens and the girlfriend is watching a period drama.
,premier league on sky club world cup on bbc good job ive got two screens and the girlfriend is watching a period drama.
,girlfriend is crazy . wtf ? how old is she ? if he telling her to shut the fuck up . creating drama were there isnt any .
,no. im telling you that your girlfriend is a drama queen and doing the withdrawing into myself because im so deep thing for extra attention.
,your girlfriend is a drama queen.
,your girlfriend is an asshole for how she responded big time making a poll amongst friends sheesh what a drama queen. nta
,meh some do some dont. my current girlfriend is completely games free no drama excellent communication. i knew she was a keeper right off the bat
,a korean drama called  my girlfriend is a gumiho i think
,it was a korean drama my girlfriend is a gumiho
,my first drama is my girlfriend is a gumiho! i loved it!
,your girlfriend is being a drama queen. you took a big first step and did the best thing for both of you. things will get better.
,my girlfriend is an actor at a drama university of course i have watched theatre
,my flatmate is straight and his girlfriend is just lovely. i couldnt stand the drama
,my girlfriend is so much drama.
,your girlfriend is hugely over-reacting and tbh in your position id just move on. that kind of drama just isnt worth it.
,a cdrama my girlfriend is an alien.
,clearly your girlfriend is the problem. dont get sucked into her drama. there is a name for this!
,esh. and you deserve each other. your girlfriend is stone cold ditching you like that and you apparently are a drama queen who cant function well.
,atleast svenskaren never tried to bang the owners ex girlfriend. is there some juicy drama im not aware of
,i would have laughed my head off no need to punch him your girlfriend is being a drama queen
,this girlfriend is nothing more than a self-absorbed drama queen. dump her and find a new girlfriend who appreciates you.
,what prevents drama is establishing whether your girlfriend is capable of trust or is jealous and crazy early.
,ehs and your girlfriend is such a drama queen. you stop crying over periods in your early teens. jeez grow up.
,sounds like your girlfriend is trying g to start some drama. or she has some sort of mood swings
,remember that korean drama my girlfriend is a gumiho? buttplugs x
,i like how ciscos girlfriend is like in the real world people understand why wouldnt tell someone straight away and no drama comes out of it
,she could be lying. in which case is it my responsibility to tell him that his girlfriend is lying to create drama?
,nta your girlfriend is a narcissist and a drama queen. she doesnt own the cap and she doesnt get to dictate who joins it.
,yta and from the sounds of it a bit of a drama queen to boot. month girlfriend is still like. testing the waters level new.
,domestic girlfriend is stress and drama free wholesome love story. everyone should watch to get a load off. their shoulders
,its a korean drama called my girlfriend is a gumiho  ninetailed fox from.
,a korean drama called my girlfriend is a nine tailed fox.
,my girlfriend is a gumiho the only k-drama ive ever watched.
,omg i actually loved this show! its a k-drama called my girlfriend is a ninetailed fox its pretty adorable and bizarre.
,nta. i think your girlfriend is creating drama for the fun of it.
,to prevent any drama and issues while you both sort things out. and it sounds like your friends girlfriend is helping her out.
,date older.my girlfriend is years older than me and ive had non of the typical relationship drama.plus hey no chance of pregnancy
,they made a korean drama out of this and i loved it. its called my girlfriend is a gumiho
,sauce  k-drama titled my girlfriend is a gumiho
,i prefer to hang out with guys girls are too much drama amp b my girlfriend is exacly like that but i dont have a problem with it.
,your girlfriend is such a drama queen that even i felt relief when she dumped you. congratulations on your new and improved stress-free life!
,who tf pretends their girlfriend is hillary clinton?  rneoliberal users? got us
,cheryl a year old asking another year old to live with her as her girlfriend is a perfect set up for drama filled disaster  d
,my girlfriend is abusive and i still cant live without her. i have options but feel addicted to the drama. dont know what is wrong with me for real..
,my girlfriend is following the jimmy butler beef just for the drama she barely understands basketball but this shit is universally hilarious
,op says in the commemts it isnt. i think the girlfriend is either a drama queen or an idiot.
,we have a lake house and if someone acted this desperate to come to my house just because his girlfriend is a drama queen id uninvite him too.
,your girlfriend is what is known as drama i mean to be perfectly fair shes years old. theyre pretty much composed of drama and awkwardness.
,your girlfriend is stirring up shit for the fun of it. i would keep an eye on that. people who make drama around them are no fun to date.
,ice and his drama with his wannabe kardashian girlfriend is more normie than any other stream right now.
,uhm..no dont think so. your girlfriend is your girlfriend. i dont like drama
,are you my girlfriend is my favourite drama western. i based this off with the left its more like stalin if anything..
,dude youre way too young for all this drama. your girlfriend is a spoiled brat and then some.
,reply and eun ji won. eun ji won plays a high school student in the drama and his girlfriend is a big fan of eun ji won the idol.
,my girlfriend is a bit allergic to my cat haha so it would actually turn into a total drama.
,always believed kurt in all that ex-girlfriend is an assassin drama.too insane to make up!
,there was that one korean drama a few years ago about gumiho  my girlfriend is a ninetailed fox
,your girlfriend is-years-old and she needs to grow the hell up. i would never put up with that sort of bs drama.
,nope. your girlfriend is a liar. you deserve better. break this off and end this drama.
,colour me suspicious. i think your girlfriend is making it up to look for potential drama. record yourself to prove it.
,this isnt drama. this is reddit shitposting because op got banned from a stream. vasilii beating his girlfriend is drama.
,go like her page on facebook. i love her show but girlfriend is a drama queen.
,yeah your girlfriend is a drama queen. yikes.
,yeah the cws tend to be teen drama but crazy ex girlfriend is more adult themed.
,his girlfriend is perfect for his stream. he got popular from wo w and drama and he doesnt play wo w anymore.
,my girlfriend is a gumiho. i have yet to find a drama that i enjoy more then this drama.
,honey did you see my electron printed sculpture.  girlfriend is sewing on a button
,thanks shakespeare. hope your girlfriend is doing well.
,my girlfriend is a shakespeare nerd so good advice
,not even close to crazy we had a girl lit her wrist in our bathroom and write poetry on the walls very sad i hope she is doing better
,i could watch this beautiful girl for hours she is poetry in motion.
,she is light and truth incarnate when she can pivot lame fanboy shops into poetry.
,sportcruiser is incredible. she is so talented and i feel really honored that she would even want to share poetry as personal as this with us
,im just so glad she is getting some love. her poetry book is fantastic and she was so influential on my songwriting.
,she is. is she a homophone or a rhyme or both? hm. i see that they would be considered identical rhymes that many consider inferior.
,i seriously hope she doesnt get any tax dollars. if she does she is the poster child of government waste. i dont need poetry in any way.
,bjork actually had some great songs though like pagan poetry hyperballad  she is much better when somebody is remixing her first drafts
,except that she is really the male author and his love of poetry and chivalry.
,edna st vincent millay is the person who made me fall in love with poetry. she is neither pink nor pale and she will never be all mine.
,my wife has this poem on the wall of her studio. she is a painter i write poetry.
,bad poetry? oh no-etry! meet my girl she is my venus soliciting poet gets between us.
,no idea but i love that girl. she is probably the most knowledgeable on this bitch and she absolutely detests her. outright pure hatred. its poetry.
,there arent many writers who are a triple threat like margaret atwood. she is gifted at novels short stories and poetry.
,she is my drug dealer. her songs make me high. potetry. just poetry.
,when asuka and rei meet she is reading german poetry or folklore.
,she actually writes poetry and short stories actually she us adorable _ she is mt favourite girl in porn
,it looks like the girl who writes shitty goth poetry in her invader zim notebook and cant stop telling you how edgy and random she is.
,apollo god of knowledge music poetry and of archery plagues and sudden death. and my sister is a batshit crazy holy terror. with killer dogs.
,she is so ridiculously adorable!! i would kiss that face so many times a day. her zoomies are very athletic. pretty much poetry in motion
,no. but i found a girl that has a soundcloud and shares poetry with me so im feeling ok about it  she is my antonia and my anne shirley
,my sister is a bitches my whole familys a bitch.  this is real poetry
,my twin sister is an infp and she love poetry but not me i like just like books
,my sisters are fucking annoying little shits that think they are woke cuz they listen to slam poetry about rape.
,all about the benjamins is a song lyric. she is saying they are influenced by money not that money is the only thing. you are taking poetry literally
,well i mean she is writing poetry about basic food chain parameters?. you do t say how old your daughter is.
,every day. sometimes she is the source of inspiration to do stuff. like songs or poetry
,im rewatching and i saw the episode where shes dropping out of college after her mom died and she is telling her professor she loved poetry!
,thats good i dont want to diminish what that meant to you but she is neither a good poet nor a good person
,i recommend checking out her poetry because she is really a lot more talented with words than this interview makes it seem
,go the opposite of what she is. go simpler. 2 pacs poetry. i think he has books. girls love pac. peace.
,im glad you posted this. i have written a lot of poetry about my nmother and i dont mince words. she is a bitch and my poetry says it all.
,i grew up writing poetry and philosophy and behave a lot like yuri.  so why dont i think she is best girl wry
,she is the poetry master the other dokis poems pale in comparison
,i had a girlfriend who liked this album and rejected me for the scars on my arm. she is happy now making bad poetry in or after her mfa. i am here!
,my sister is art teacher
,holy fucking shit i dont usually get impressed by art because my sister is really good but this straight up wowed me good shit my dude.
,hour or so my sister is an art major
,well ive tried digital art recently but again my sister is blaming everything recently on my computer.
,my little sister is great at art but shes never taken that amount of time away from it. you should be proud that you still have such amazing talent.
,my sister is doing an art course what would you say for artists trying to get into the profession as a livelihood
,my sister is an artist shes older than me and she teaches me how to do art like her
,im glad surugas big sister is getting so much attention but i sure wish suruga got even half as much art.
,im not big into art tho my sister is so yea
,since she is your girlfriend maybe look into some poetry by pablo neruda. he is a master of love poems.
,these are beautiful. my sister is a rep and always out and about and sends me street art pics love them -
,i still have the surface book. i used it most of college as an engi student and now my sister is using it for art and engineering!
,love your art! the gemini sisters are my favorite assassins. theyre so strong.
,it bothers me how good the aesthetics of the kanker sisters are. every art of them as adults is like  damn it why do i like this?
,yeah i should post an image of him. my stuff is pixel art though haha my sister is the one who does pencil art and such for my characters
,your sister is awesome at art!
,your sister is an awesome artist tell her i hope she does more arknights art
,nta. youre using his pictures for art purposes not to jack off to. your sister is making it weird
,im so sorry she did this your art looks amazing and its clear you spent a lot of time on it as well as your soul. your sister is trash.
,im just glad that the crane sisters are getting a lot more attention even if it comes with the sacrifice of some lewd fan art.
,yea sure everybodys sisters are making cool art now in fortnite?
,claire waited stayed true and wrote dude poetry while on the inside. she is best girl.
,yeah! my sister is pretty good at art stuff. so she put our last name on there
,you monster. they are dying and their sister is in critical condition! free art was all they needed for the cure.
,my little sister is in it. i dont mind her being in it as it gives her something to be passionate about making art.
,apparently the twin sister is carrying on the screen name amp doing art.
,i see a dodge. somebodies sister is gonna love that art work
