id,comments_processed
,tamra is really reaching for drama with peggy. the new girl is an easy target
,its a tear jerker now but in years that girl is gonna be a drama queen.
,any ultimatum from a non committed girl is drama for me. she is free to leave.
,hypothetical if a girl is very interested in other peoples relationship drama is that a red flag?
,this girl is tana mongeau she acted like a drama queen over another you tuber named idubz saying nigger. she cried on periscope over a single word.
,hes a brand builder thanks to the drama and the girl is for sale to the uae like the rest of them are.
,my type of girl is one who is trilingual read books has a soft sculpture and has made iconic music videos that outsold the queen of pop
,my girl is technically a found object sculpture
,girl is a damn sculpture. exquisite
,towering effigies of ganesh making their way to the sea. also dancing girl. dancing girl is my favorite ancient sculpture of any kind.
,bruh your wife is the secret cum covered wookie sculpture hidden in your room
,im an entp my wife is an isfj. we both love art. we once spent hours on a train to see a single sculpture.
,could you do a baby doll head body arms legs. my wife is a sculpture.
,my girl is a straight up sculpture
,this looks like some kind of sculpture i dont think the girl is real
,one wife is not enough is the name of the exciting water sculpture in the background
,this girl is a greek sculpture
,the weird image of the girl is an asian sculpture in some museum somewhere its just horrifying.
,your wife is pretty badass. its a wonderful sculpture. hope she sticks with it.
,if by gorgeous you mean absolutely caked in makeup uh. sure? the girl is naturally attractive in this photo she looks like a waxwork sculpture.
,this sculpture of lots wife is all wrong. they didnt even get the gender right!
,my wife is having and affair with my adviser william shakespeare.
,my wife is getting a masters degree here in shakespeare studies
,so it wass and a peacefull day but then i saw this event. william shakespeare and my wife is together? what!? ok william we must talk.
,the idea that shakespeare was gay because he ended up hating his wife is also pretty stupid.
,my wife is an english teacher. she always says this is the modern telling of taming of the shrew by shakespeare.
,well in westeros a girl is an adult at if you want to get technical. just like japan mexico and shakespeare plays.
,. and thats why i think  la blue girl is up there with the works of shakespeare.
,trump raw dogging porn stars and grabbing puss while his immigrant trophy wife is pregnant. youre like william fucking shakespeare i love it.
,my wife is distantly related to william shakespeare by marriage. and before you ask yes she is a writer.
,bunny girl is ao a. shakespeare play im assuming you mean boarding school juliet which is amazon.
,wife is an english professor and totally into shakespeare. our first cat is named shakespurr. then clawdio purrcutio. the new baby is calpurrnia.
,my wife is an authority on shakespeare but she found the shakespeare questions hard.
,having sex with someone elses wife is adultery dumbass and im pretty sure shakespeare is a better source in what his words mean than you are.
,til the name hermione is from shakespeare. this girl is going to be the brightest of her age.
,girl is titania confirm? heh heh shakespeare heh heh im sorry bad joke
,you forgot but has a heart or gold or secretly writes poetrydrawshelps out at old folks home his grandmother is housed in
,god woulda let them they said noah ur mom is gay imma not listen to what u say poetry
,stop texting my mom is the most beautiful text ive seen from these psychos and i wish it would happen more. hilarious. its poetry in motion.
,and fucking potatoes is back on her bullshit with a lengthy spoken-word poetry entry about how shitty her mom is. christ.
,my mom is and can still recite a bunch of poems. i always get the feeling all the old soviets i know look down on us for not knowing any poetry.
,that was a little more original than  dude your mom is hot. its not exactly poetry but its something.
,her mom is the muse of erotic poetry what did you expect?  because i didnt feel like sitting with other people
,my mom is an old hippy who uses facebook to showcase videos of her drinking wine and dancing or reading her poetry. i win.
,the bride is lovely and the dress is a work of art. glad you shared it!
,yup. my stepdaughter is an artist. she gets gift cards to some of the more specialized art supply stores or completely unrelated gifts.
,thats so funny my mom is the one that drew the lesbian mermaid art. she never gets credited
,his mom is a famous art theif this is the original the so called original is just a copy that looks like it
,sauce this is a nsfw artist but this art is not nsfw enough to be considered hentai so i guess this is fine. also its her mom is an adult.
,her mom is carol connors who starred in the porn classic deep throat. they probably hold more progressive views on nudity in art.
,a leftie! my mom is a leftie. in art classes were now encouraging kids to use their dominant hand
,that box art for the princess bride is pretty rad
,yep bride is still a very good st art nuke
,my mom is trained as an artist im trained as an artist an art. historian.
,aw thanks! its mainly patience my mom is an artist too but i got into more digital art myself
,yup my mom is an adjunct art teacher at harvard and is constantly under financial strain. its insane how our educators are so criminally mistreated.
,doras supposedly-well-endowed mom is comparable to  tai in modern art style.
,your mom is a gosh dang work of art
,my mom is a total dick about my art. ill show it to her and shell point out the one flaw in it. i stopped showing her. show us instead!
,i would tip heavy for that kind of attention to detail and pure art work. and my mom is a hoe. fo sho.
,its art art isnt necessary to be paintings for example what i do with your mom is a diff kinda art
,if youd be interested in an art piece version of everyone is john bluebeards bride is all right for a one-shot.
,your mom is an expert. introduce her to art selling marketplaces so she can get monetary benefits from her hobby.
,i also want him to move as my mom is the one who makes the money and sacrificed her art career to keep a steady job.
,my mom is really into faceless people art like this herself and this thread kinda makes me think about why that might be haha
,your mom is like  there is no way that the blue and yellow wolf standing up on two legs wearing a casual outfit is furry art
,i thought i was the only one big mom is amazing and terrifying. awesome art! keep it up
,bini legit just wants to share his artwork with ari and her mom and mom is being awful. shes just stirring the pot.
,listen dude i am like art i am not the problem my mom is i want to browse art without my parents blowing about it so dont misunderstand
,your mom is nice for letting you hang your shitty art on her wall
,the art of persuasion is trail and error and every mom is difficult
,for art? my mom is an accountant with a masters for one of the biggest companies here and she makes  a month
,my mom is art major and once said to me he looked like he was sitting on a toilet to her. nice to see other people see it that way.
,can we all talk about how beautiful the art in jo jo is compared to other animes? even my mom is very impressed and likes watching it with me
,schooling as we know it will be inevitably done for. especially for being an art teacher your mom is right you know.
,thats a good idea. i have a friend whos mom is an artist. ill help them out by buying her art for a few million.
,mom is just attention whore under the thin veil of art and body positivity
,mom is just an attention whore under the thin veil of art and body positivity
,no but my mom is an artist and she gives a lot of art to friends so ive come across her work a lot on thrift shops actually lol.
,his step mom is an art teacher
,your mom is art dude
,nah this took me like a minute. my mom is an art teacher. i know my colors
,i have no patience for sewing. mom is amazing she does these really cool art quilts. right now shes obsessed with making purses.
,you can have it for free if i have it. only thing i like from mom is art
,i understand why your mom is upset. theyre gonna have to remove the wall and put it in an art gallery. it will be the only art i can appreciate.
,bro its amazing your mom is probably very impressed by it but she is just jealous that you have that work of art in your room and not hers.
,i believe her mom iswas a vcu art proff. she has posted richmond stuff on boingboing before.
,my mom is an art teacher and good lord did this scare me
,my mom is an amazing artist she does abstract stuff with amazingly bright color. her art is insane i dont know how she does it. w.robinlwest.com
,your art is amazing and youre mom is so gorgeous!
,i believe chloes mom is the same voice actress as princess rainicorn. that and the art style probably
,my mom is quite familiar with this martial art.
,my mom is an art major. without art thered be nothing.
,my headcanon is that normal roy mom is hector. great art!
,why mom is on the header art?
,im confused there is only. the bride is one of them just as an adult. these are all chapter covers and each quint got a unique bride art
,sword art online  yes you can shoot me for real though my bride is a mermaid
,i relate so hard i swear my mom is like why dont you change your art
,your mom is proffesional minecraft pixel art maker
,this is art. your mom is an artist.
,yta. your mom is dead and plenty of people make a fine living in art.
,unfortunately my cousin aka her mom is too busy with work. tipikal anak orang kaya kan jadi anaknya art dan guru les.
,spider mom is gonna getchagood art!
,oh crosses on a wall as art! your mom is a real classy bitch.
,your mom is not art
,my mom is an art conservator. she absolutely loves it but its definitely not something id have the attention span for.
,oh wow. what a piece of art. your mom is an artist
,im also indian  and my mom is an art teacher so.. beautiful work. youre a great artist.
,im not even home schooled and my mom is making me do all the classes like art pe music the whole shebang.
,the opening scene of that episode where hes having an imaginary conversation with his dead mom is just pure art
,dembe birthday party. reds looking for an art forger. lizzie told ressler that her mom is alive because of course she did.
,but bride is more versatile on arts team and art up is common af
,im a big sucker for great card art and my goodness the plant based bride is so pretty o
,your mom is possibly the coolest mom out there for mastering the art of cake rick and morty style!
,youre fine. i cant even start to draw that good even though my mom is an art teacher
,i hate how grossly photoshopped his mom is to the point where she looks like an edgy social critique art piece
,my mom is actually an art teacher so i think she was happy i was being creative!
,sorry i just want to appreciate the ace attorney art in the background. and yeah your mom is definitely crazy. wow.
,my mom is an artist and ive never done any art of any kind. i actually thought this was really bad but it took me hours so i uploaded it
,more so hobby. i might sell on the side my mom is friends with a guy that sells local art in his coffee shop so well see
,your mom is amazing dude and she is right about that game is a piece of art and finally whats was the plan ?
,your mom is a beautiful piece of art!
,i gotta say your mom is probably really cool. i mean i see fancy pants ddlc art deadpool and undertale. thats really cool.
,maybe the ops mom is the roger federer or art.
,thank you! yup although my mom is an art teacher so i like to think she passed her artistic genes to me
,aw i love this! my mom is ath grade art teacher i wonder if she can get her school to do this.
,ok so i found the artist and hes def calling out the mom which is just amazing to have people sharing this art thinking its saying the mom is right
,your art is awesome and that interaction with your mom is great are you guys actually from ireland?
,if your mom is skilled enough in the martial art of flying chanclas itll bounce back to her hand after it hits you
,your mom is a student in the art of shitposting. with more training she could become one of us.
,going home. my mom is making me help her set up for an art class for my art teacher to do an art night.
,my mom is reading the gentle art of swedish death cleaning. the other day she gave me some bowls i said i liked.
,work of art! im sure your mom is gonna love it!
,trying to sell your art you didnt. your mom is misunderstanding this.
,kancolle umu. i love umu but og umu has pretty avarage fa art bride is neat but. swimsuit  long hair umu  heaven
,your mom is definitely not bad at art
,depends. what do they like and how much money do you have? my mom is into painting so i get her art supplies.
,your talent and hard work is incredibly. and your mom is gorgeous. your art makes her look like a happy and gentle soul.
,your mom is stunning! and that dress is beautiful. tell her that she shouldnt edit a work of art. shes beautiful.
,pretty art style! love how much of a background character the mom is.
,my mom is a housekeeper at buildings like the artsociology building and the math building and she says they open at
,your mom is skilled in the art of parenting. good for her!
,my mom is deaf so im used to them and life them. there is an art to not focusing on them tho. i can see how theyd be distracting.
,you have mastered the art of the hidden cam and i applaud you. your mom is is begging for some attention lots of it in fact
,yes its very beautiful! my mom is an alumni of the art program there so ive been up there a few times.
,my mom is never down for that. always wants to see some art house crap the new yorker is pushing instead. yuck.
,your mom is art
,the guy who originally painted the mom is the same guy who does the art for minecraft no lie
,baking is chemistry. cooking is art. my mom is a great cook but cant bake for shit.
,yeah i see her about twice a year. i love their little house. and my mom is rad. she has a wood shop out back which is her art studio.
,wow your mom is quite talented! its an intriguing piece of art and i love the details with the shirt.
,til ops mom is art
,damn this is a work of art and maybe not answering cause your mom is probably driving mph down a freeway to murder you lol
,today. found out my mom is in renal failure with newly found bladder cancer. fuck art today. just makes me more angry
,your mom is art
,sorry mom you were born on same day hitler was kicked out of art school and you know the significance of that. extra points if mom is jewish.
,i relate.. hate sharing my art but my mom is always like wowowow you should show everyone your art!
,your self-taught mom is stunning and so is her art
,thats an awesome find. the art is gorgeous. the grandmother is one of my all time favourite short films
,the characters are from monster musume well the mom is at least this looks like fan art of a scene where the older one is imagining having a child
,doggie day care was someones crazy idea that is turning out to be pretty popular. the art for mom is great.
,adorable art! im sure your mom is gonna love it.
,there is renaissance art then there is me macaroni art stuck to the fridge that my mom is damn proud of.
,im surprised about number my gfs mom is an art teacher and loves art and they go to all kinds of art festivals all over the state.
,nice job! i am super proud of you and i am glad your mom is accepting. it is really nice art as well it really well.
,ur mom is a disrespect to music and art
,tattooed mom is one of the best on that street imo. most of the patrons are usually respectful and i like the art sales.
,barbies stuffed animals home-made building blocks and a ton of art supplies since my mom is an artist and wanted us kids to learn to be creative.
,non-futa equinox art?! does that mean space mom is coming back too?
,art theft is not a joke jim  your mom is wonderful
,when they go to the art museum or whatever it was the mc tells the shopkeeper that her mom is an art prof
,my mom is showing some art there today im headed there in a bit.
,my mom is an art teacher can confirm
,truly beautiful art! happy to know your mom is helping keep traditions alive.
,very good art! goat mom is best mom.
,anyone else a bit confused why a mom is on the fortnite subreddit? its a amazing art piece and i could only dream of this but a little fishy.
,my mom is new to ig and also has an art account
,what the actual fuck? your mom is horrible. has she ever heard of an art museum?
,my mom is encouraging to me just..she talks about art like she knows how being an artist works when she really dont  thanks for the upvotes too
,my mom is interested in the gameplay but she doesnt like the pixel art style so she wont play ist.
,yes it is  my mom is an art teacher and she gave that to me as a birthday gift years ago
,your mom is art.
,just checked your profile your tattoo is gorgeous. so sorry that your mom is being so terrible about such a wonderful piece of art.
,lost potato brave potato dragon potato jojos bizarre potato potato art online my bride is a potato date a potato potato eater etc.
,my grandmother is chinese and hawaiian so i was around chinese art furniture and cuisine when i was growing up. he has .
,beautiful. your mom is incredibly talented and sweet. you could also post it at sub. todoroki stuff is always welcome and yours is a work of art!!
,i think this belongs in roldschoolcool titled mom is a retired art instructor. seriously strange stuff in that sub.
,how lucky your mom is to have a child that will learn a new art form to make her such a sweet gift.
,your mom is a literal art god
,when your mom is an art teacher .
,aw! quite a nice piece of art! i like the soft colours in this especially! mom is one of the best side characters hands down.
,the andirondacks. my mom is a fan of the art style and wants to see the mountains. and thanks!
,if he keeps making cheap stuff like that well be ok  p his grandmother is a retired art teacher and she gives my twins an art class once a week.
,i love you. your art is the cutest. do you take commissions for art? my mom is writing a childrens book and i think she needs an artist.
,mom is pointing out the very obvious that this art is not easy to make
,ah parental passive aggressivness. my grandmother is a master at that art.
,you put it so eloquently considering how wholesome that art and grandmother is.
,kill art school hitler mom is to old to start again
,i mean my mom is an artist and it isnt uncommon for me to just ask to see her take on a certain piece of art.
,my mom is skilled in the art of rifling through my pictures in seconds lmao
,my mom is a piece of art
,your mom is also the hottest art teacher ever
,rich parents. mom is a jewelry designer and pops is art curator.
,your mom is better than me and ive been doing art for years
,your mom is the next bob ross. tell her to continue drawing and you should post your art too
,definitely has as look going on very art deco nouveau. your mom is crazy.
,thanks! his mom is trying to get him to go into art but he wants to do medical
,yeah if anything my mom is more picky about my art than the actual client im making it for
,your mom is buying your exs art?
,this is amazing fricken art. your mom is wrong as hell
,your mom is the art.
,fuck the assholes here your mom is an artist and i love her art so tell her that!
,mom is damn good have her show more of her art please!
,you know that mom is going to be like  did you see what your penis art landed me!!
,oh the box art is my new favorite! and yes a pop from mom is always the best
,theres the sword art online abridged series by swe if you count that. otherwise my bride is a mermaid is great
,dont see much use for him still tm big mom is just better. nice art tho
,a red hood there is a picture he drew of his alter ego when the mom is looking at his art book.
,youre mom is like.. art-level pretty.
,your mom is art
,so my friends mom is an art teacher. she once had a kid whose name was pronounced sha-thayd his parents legitimately named that poor kid shithead.
,i love that you can buy your dss art! thats an amazing fundraiser. im sorry your mom is so superficial.
,your mom is trashy art.
,my mom is super talented in my completely unbiased opinion. check out her art here
,my mom is nurse can confirm she art thou best
,your mom is art.
,nope. my mom is a teacher. her breaks are whatever extra class is that day art pe. she has to monitor the lunch room and recess time.
,art imitates life. wait big mom is real base on this drawing of her so. devil fruits are too!
,my mom is into the art car scene she has a flamingo jeep. i swear i saw this at the fremont solstice show but im not.
,ur mom is art
,my mom is very excited to see that black and white art exhibit.
,id say its an amalgamation of victorian brutalist and art deco. im no expert but my mom is so ive gotten familiar with architecture.
,scaring your mom is an art form
,this is so magical and wonderful a piece of art. your mom is very talented!
,better at music than art i hope you went right off the fucking canvas your mom is gonna be so pissed.
,birthday parties are not art. hugging my mom is not art.  feeling is not what art is. art often elicits no feeling whatsoever.
,the profile pic of your mom is a work of art
,the car and wine are so on point. source mom is art teacher.
,your mom is an art milf
,i could make an entire sub of his art and our mom is pressuring me to do so thanks to all the positive feedback
,awlrighty it was for an art project but now im gonna bang her as soon as your mom is done cleaning her snizz off my sac
,the music of  farah abraham from teen mom is so atrocious it almost becomes a bizarre piece of art.
,your mom is an art teacher youll be fine
,your mom is awesome and so is your art.
,he is learning. its like his main thing. and my mom is an art teacher and she is helping him
,li shuwen nursey rhime for art based np nero bride is ok too martha emiya for arts in their decks  in jp there are alsos  bb and sherlock
,animation  art style preach. its annoying how often this comes up especially for some shows. the ancient magus bride is extremely guilty of this.
,i do love art! my grandmother is a professional watercolorist. i paint too.
,my mom is an art teacher and has had this happen more times than she can count.
,when he went to the white sox he gave my middle school free tickets. his step mom is a terrible art teacher btw
,please provide a link if you do. my mom is an art teacher and is about to retire this print would be a great gift!
,pretty much if chrisjen worked in education and not administration. cursing is an art form and mom is one of the great masters.
,so cute!! is her art for sale anywhere? your mom is v talented!
,my mom is sick and the doctor said she needs art to get cured!!
,id say the art is fine but i literally cannot tell what the faces the mom is making are supposed to be.
,this is a really interesting take. ive been doing art similar to emdr for about months and i can see what your mom is getting at.
,wow thats actually pretty good for a first try! glad your mom is a climbing the art lobster hierarchy!
,i love her art style! your mom is amazing at art!
,your mom is art
,i have faith that mom is going to synthesize the messages she gets and not shame her kid with hey i showed reddit your art and they loved it!
,bro your mom is a beautiful work of art.
,your mom is pixel art
,obviously we still dont know if jesters mom is tiefling but that fan art was so sweet.
,your mom is either evil or gay. ill give you a clue i studied art.
,i hope so! princess bride is a work of art.
,my mom is also making layered paper art but i have to say this stormtrooper looks way cooler than her santa claus
,i know its too late now but if your mom is the one making you go to art school she shouldve payed the bill i think
,my fiance is an artist and ive gained a greater appreciation for art after seeing her work. your mom is incredibly talented.
,your mom is true art.
,i wonder if there was art done in chalk or something similar. where ops mom is the bad one here. i mean everyone knows what ops mom is like.
,fjorms mom is genos she got turned into modern art.
,my mom is still using the bedside art deco clock she got for her wedding in. that alarm is something else.
,your mom is really crisp art.
,a nice side benefit of having a former punk as your mom is it is nearly impossible to offend her with cover art
,i thought my art was a talent. not an ability i have just because my mom is magical.
,your mom is art so can i fuck her
,dance in the vampire bund dragonnaut katanagatari kurozuka white  my bride is a mermaid
,the bride is probably just thinking how much better she is at oriental dance. that wasnt very good.
,balance. it would look even worse if it was the l source my mom is a graphic designer and i took one art design class in high school
,context my mom is a high school teacher. i guess she took her students on an art tour and she just sent me this text
,the art behind his mom is hot af
,yes but your mom is excellent in the art of respite and recuperation of people amongst other things.
,unless your mom is legit nuts i think thats cool. a lot of people love and collect vintage photography furniture art textiles etc.
,my mom is an art teacher and has this book on a bookshelf in her classroom. its so cringey and stupid i cant believe it exists
,youre mom is really bad.  youre actually right. the art is bad. i got overzealous when i say a not-floating-heads piece of poster art
